{"archive_byte_length":487,"archive_ref":"contracts/fixtures/governance-models/support/m0-g0-issue-register-replacement-archive.md","archive_sha256":"5f282ded72c72eee9cb00a4611f42c775a76c830cb7325ba6e253ab95915b97a","read_back_at":"2026-06-01T12:03:20Z","readback_authority_ref":"contracts/fixtures/governance-models/valid/m0-operation-authority-issue-transition-readback-issue-readback.json","readback_authority_sha256":"a1a09f68b9cbd4aaed87f401be87c6ec855a580188296e8a10f97907463fa2df","reader_id":"fixture-m0-issue-transition-reader","receipt_id":"fixture-m0-g0-issue-register-transition-readback-receipt","receipt_issuer_id":"fixture-m0-terminal-receipt-issuer","result":"MATCH","schema":"ylx.g0-issue-register-transition-readback-receipt.v1","signature":"MDYRUVr04TpiHM5vESrakuFV9oN6QaAVTPTeQt1nlotPdy84EKxkUU/4VM7S3U94uLSCoWcSEHiq+MinYg9xCQ==","signature_algorithm":"Ed25519","signed_payload_sha256":"eb92dba6a47071e440f987a02324ccc8246a7e642b816e0e171b9199a09261cf","signing_key_id":"fixture-m0-terminal-receipt-issuer-key","source_byte_length":487,"source_ref":"contracts/fixtures/governance-models/support/m0-g0-issue-register-replacement-source.md","source_sha256":"5f282ded72c72eee9cb00a4611f42c775a76c830cb7325ba6e253ab95915b97a","successor_head_byte_length":2649,"successor_head_ref":"contracts/fixtures/governance-models/valid/m0-g0-issue-register-successor-head.json","successor_head_sha256":"c9050707bc5f89ea300b61896c5faa2197e59d4c88081553d4b2707580162240","terminal_sink_id":"fixture-m0-terminal-audit-sink"}